Manhattan,1028636,15,WEST 72ND STREET,122554324,1,A2,N,482,482,No,RESID. BLDG - OLD CODE,RESID. BLDG - OLD CODE,2/4/2016 0:00,2/3/2016,Initial Permit,EW,Issued,Initial Permit,0,0,No,,,Y,3,"COMBINATION OF APARTMENTS 2UV AND 2T ON THE 2ND FLOOR.  MINOR PARTITION AND PLUMBING WORK.  NO CHANGE IN USE, EGRESS OR OCCUPANCY. APTS 2U &amp; 2V ALREADY COMBINED UNDER DOB JOB APPLICATION# 102685275."
Manhattan,1028636,15,WEST 72 STREET,140339792,1,A2,N,490,490,No,RESID. BLDG - OLD CODE,RESID. BLDG - OLD CODE,6/8/2015 0:00,6/1/2015,Initial Permit,EW,Issued,Initial Permit,0,0,No,,,Y,3,"FILED TO SIGN OFF ERRONEOUSLY FILED ALT-1 APPLICATION JOB #100239868 (1991) TO COMBINE APARTMENTS 29D &amp; 29E INTO ONE APARTMENT 29DE UNDER THIS  APPLICATION AS PER LOCAL LAW 77 OF 1968 AND TPPN 3/97. GENERAL  APARTMENT RENOVATION. NO CHANGE IN USE, EGRESS OR OCCUPANCY."
Manhattan,1028653,57,WEST 73 STREET,122619620,1,A2,N,11,11,No,RESID. BLDG - OLD CODE,RESID. BLDG - OLD CODE,7/5/2017 0:00,7/5/2017,Initial Permit,PL,Issued,Initial Permit,0,0,No,,,Y,9,"COMBINE TWO APARTMENTS (1B/1C) INTO ONE UNDER TPPN 3/97. NO CHANGE IN EGRESS, USE OR OCCUPANCY INVOLVED UNDER THIS APPLICATION"
Manhattan,1028655,53,WEST 73 STREET,121704968,1,A2,,10,10,No,RESID. BLDG - OLD CODE,RESID. BLDG - OLD CODE,3/18/2015 0:00,3/18/2015,Initial Permit,PL,Issued,Initial Permit,0,0,No,,,Y,3,"COMBINE APT.B (BAS) AND 1B (1ST FL) TO FORM DUPLEX APT. NEW PARTITIONS, KITCHEN CABINETS, FLOORING, DOORS, PLUMBING FIXTURES. NEW ACCESSORY STAIR. LEGALIZATION OF WORK PERFORMED WITHOUT A PERMIT FOR WHICH VIOLATION # 34618479 R WAS ISSUED."
Manhattan,1028661,23,WEST 73RD STREET,123228774,1,A2,N,250,250,No,RESID. BLDG - OLD CODE,RESID. BLDG - OLD CODE,2/26/2018 0:00,2/26/2018,Initial Permit,PL,Issued,Initial Permit,0,0,No,,,Y,30,"FORMALLY FILING ALTERATION TYPE II FOR UNITS 302A-302B. COMBINE TWO APARTMENTS AND RENOVATE ONE (1) KITCHEN AND ONE (1) BATHROOM AS PER PLANS, INCLUDING PLUMBING WORK. NO CHANCE TO USE, OCCUPANCY OR EGRESS IS PROPOSED UNDER THIS APPLICATION."
Manhattan,1028689,59,WEST 73 STREET,123902152,1,A2,N,15,15,No,RESID. BLDG - OLD CODE,RESID. BLDG - OLD CODE,2/6/2020 0:00,7/30/2019,Initial Permit,EW,Issued,Initial Permit,0,0,No,,,Y,14,"COMBINE APTS 9 &amp; 11 ON THE SECOND FLOOR. NO CHANGE IN USE, EGRESS OR OCCUPANCY."
Manhattan,1028689,59,WEST 73 STREET,140737610,1,A2,N,15,15,No,RESID. BLDG - OLD CODE,RESID. BLDG - OLD CODE,8/24/2018 0:00,4/1/2019,eRenewed,EW,Issued,eRenewed,0,0,No,,,Y,14,"COMBINE APTS 5, 6 AND 7 ON THE FIRST FLOOR. NO CHANGE IN USE, EGRESS OR OCCUPANCY."
Manhattan,1028716,8,WEST 75 STREET,140559562,1,A2,N,14,14,No,RESID. BLDG - OLD CODE,RESID. BLDG - OLD CODE,10/13/2016 0:00,4/3/2018,eRenewed,EW,Issued,eRenewed,0,0,No,,,Y,13,"REMODEL AND COMBINE APTS 3B AND 3C ON THE THIRD FLOOR. NO CHANGE IN USE, EGRESS OR OCCUPANCY."
Manhattan,1028742,56,WEST 75 STREET,140194849,1,A2,,13,13,No,RESID. BLDG - OLD CODE,RESID. BLDG - OLD CODE,5/6/2014 0:00,8/29/2016,Renewed,PL,Issued,Renewed,0,0,No,,,Y,8,"REMOVEL AND COMBINE APARTMENTS 3A,3B,3C INTO APT 3 ON 2ND FL 2B,2C ON 1ST FLR REMODEL APARTMENTS, 1A &amp; 1C IN BASEMENT;2A,ON 1ST FL;4A AND 4B ON 3RD FLR 5A &amp; 5B ON THE 4TH FLR. NO CHANGE TO USE, EGRESS, OR OCCUPANCY."
Manhattan,1028743,57,WEST 75TH STREET,123077348,1,A2,N,72,72,No,RESID. BLDG - OLD CODE,RESID. BLDG - OLD CODE,11/21/2017 0:00,11/1/2017,Initial Permit,EW,Issued,Initial Permit,0,0,No,,,Y,76,"COMBINE APARTMENTS 7F AND 7G ON 7TH FLOOR. PARTITION AND FINISH WORK. RELATED PLUMBING WORK. FILED AS PER TPPN 3/97. NO CHANGE TO USE, OCCUPANCY OR EGRESS."
Manhattan,1028743,57,WEST 75TH STREET,123088443,1,A2,N,72,72,No,RESID. BLDG - OLD CODE,RESID. BLDG - OLD CODE,11/21/2017 0:00,11/21/2017,Initial Permit,PL,Issued,Initial Permit,0,0,No,,,Y,76,"COMBINE APARTMENTS 10B AND 10C ON 10TH FLOOR. PARTITION AND FINISH WORK. RELATED PLUMBING WORK. FILED AS PER TPPN 3/97. NO CHANGE TO USE, OCCUPANCY OR EGRESS."
Manhattan,1028767,8,WEST   76 STREET,102716296,1,A1,,,14,No,RESID. BLDG - OLD CODE,RESID. BLDG - OLD CODE,4/23/2003 0:00,7/7/2015,Renewed,PL,Issued,Renewed,0,410,Yes,,Y,Y,15,"RENOVATE 2 FRONT APARTMENTS ON 5TH FLOOR. ADD PENTHOUSE AS UPPER LEVEL OF DUPLEX FOR WEST APARTMENT. COMBING MEDICAL OFFICE IN CELLAR AND CONVERT SAME TO AN APARTMENT RELOCATE AND PLACE SPRNKLER IN PUBLIC HALL.  NEW SCHEDULE 'A' SUBMITTED HEREWITH/ NEW SCHEDULE 'B' SUBMITTED HEREWITH.  CLEWITHDRAWL OF PAA DOC # 3 AS PER APPLICANT REQUEST  KARSUPERDEDED BY OTHER DOCUMENTS  PAA FILED TO CORRECT SCHEDULE 'A' AND ADD REC. ROOM TO CELLAR APT. REVISE SCOPE OF WORK: OLD:RENOVATE 2 FRONT APTS. ON 5TH FLOOR. ADD PENTHOUSE AS UPPER LEVEL OF     DUPLEX FOR WEST APT. COMBINE MEDICAL OFFICE IN CELLAR AND CONVERT SAME     TO AN APT. RELOCATE AND PLACE SPRINKLERS IN PUBLIC HALL. NEW:RENOVATE 2 APTS ON 5TH FLOOR, ADD PENTHOUSE AS UPPER LEVEL OF DUPLE FOR     WEST APT. CONVERT REAR MEDICAL OFFICE TO APT. ADD REC. ROOM IN SUB     CELLAR TO THIS REAR APT. AT CELLAR LEVEL. RETAIN FRONT MEDICAL OFFICE     AT CELLAR LEVEL. RELOCATE SUPPLY LINE AT SUBCELLAR AND REPLACE     SPRINKLERS IN PUBLIC HALL.  OLD WORK: RENOVATE 2 APTS ON 5TH FL, ADD PENTHOUSE AS UPPER LEVEL OF DUPLEX           FOR WEST APT. CONVERT REAR MEDICAL OFFICE TO APT. ADD REC. ROOM           IN SUBCELLAR TO THIS REAR APT AT CELLAR LEVEL. RETAIN FRONT           MEDICAL OFFICE AT CELLAR LEVEL. RELOCATE SUPPLY LINE AT SUBCELLAR           AND REPLACE SPRINKLERS IN PUBLIC HALL. NEW WORK: RENOVATE 2 APTS ON 5TH FL, ADD PENTHOUSE AS UPPER LEVEL OF DUPLEX           FOR WEST APT. CONVERT REAR MEDICAL OFFICE TO APT. ADD REC. ROOM           IN SUBCELLAR TO THIS REAR APT AT CELLAR LEVEL. CHANGE FRONT           MEDICAL OFFICE TO APT. WITH REC. ROOM AND STORAGE BELOW. RELOCATE           SUPPLY LINE AT SUBCELLAR AND REPLACE SPRINKLERS IN PUBLIC HALL.  REVISED SCHEDULE B SUBMITTED HEREWITH TO SHOW SPRINKLER WATER SUPPLY IS NOT OFF THE DOMESTIC SUPPLY. ADD VARIOUS FIXTURES.  OLD WORK: RENOVATE TWO APTS. ON 5TH FLOOR, ADD PENTHOUSE AS UPPER LEVEL OF           DUPLEX FOR WEST APT. CONVERT REAR MEDICAL OFFICE TO APT. ADD REC.           RM. IN SUBCELLAR TO THIS REAR APARTMENT AT CELLAR LEVEL. CHANGE           FRONT MEDICAL OFFICE TO APT. WITH REC. ROOM AND STORAGE BELOW.           RELOCATE SUPPLY LINE AT SUBCELLAR AND REPLACE SPRINKLERS IN           PUBLIC HALL. NEW WORK: RENOVATE TWO APTS.S ON THE 5TH FLOOR, ADD PENTHOUSE AS UPPER           LEVEL OF DUPLEX FOR WEST APT. CONVERT REAR MEDICAL OFFICE TO APT. __________ADD REC.RM.IN SUBCELLAR TO THIS REAR APARTMENT AT CELLAR LEVEL.           CHANGE FRONT MEDICAL OFFICE TO APT. WITH REC. ROOM. RELOCATE"
Manhattan,1028775,24,W. 76TH ST.,121035682,1,A1,,12,10,Yes,RESID. BLDG - OLD CODE,RESIDENTIAL: APARTMENT HOUSES,9/4/2012 0:00,5/4/2016,Renewed,AL,Issued,Renewed,0,0,No,,,Y,10,"HEREWITH FILE TO COMBINE APARTMENT UNITS ON 1ST FL.(#1RE,1RW) AND 2ND FL.(#2F,2R) INCLUDES DEMOLITION OF KITCHEN &amp; BATHROOM, AND NEW PLUMBING WORK AND GENERAL CONSTRUCTION.REMODEL BASEMENT FRONT APARTMENT AND NEW ACCESSORY SPACE IN CELLAR IN CONJUCCTION WITH APTS ABOVE AMENDED CERTIFICATE OF OCCUPANCY WILL BE OBTAIN"
Manhattan,1028783,42,WEST 76 STREET,121192529,1,A1,Y,12,10,Yes,RESID. BLDG - OLD CODE,RESIDENTIAL: APARTMENT HOUSES,8/10/2016 0:00,7/6/2017,eRenewed,AL,Issued,eRenewed,0,0,No,,,Y,10,"RESPECTFULLY REQUEST TO CORRECT SECTIONS 1, 9, 11, 11A, 12 &amp; 13 OF PW1. ALSO CORRECT SCHEDULE A. OLD JOB DESCRIPTION: GENERAL CONSTRUCTION AT CELLAR TO AMEND CO #102196 TO SHOW ACCESSORY SPACE AT CELLAR IN CONJUNCTION WITH APARTMENTS ABOVE. NEW JOB DESCRIPTION: MINOR RENOVATION AT CELLAR TO AMEND CO #102196 TO SHOW ACCESSORY SPACE AT CELLAR IN CONJUNCTION WITH APARTMENTS ABOVE. COMBINE APARTMENTS 1A &amp; 1B AT 1ST FLOOR AND APARTMENTS 2B &amp; 2C AT 2ND FLOOR FILED UNDER APPLICATION #140257479. AMENDED CERTIFICATE OF OCCUPANCY WILL BE OBTAINED."
Manhattan,1028797,55,WEST 76TH STREET,122966317,1,A2,N,10,10,No,RESID. BLDG - OLD CODE,RESID. BLDG - OLD CODE,10/24/2017 0:00,8/11/2017,Initial Permit,EW,Issued,Initial Permit,0,0,No,,,Y,1,"ARCHITECTURAL AND PLUMBING WORK PER PLANS. APARTMENTS 2A AND 4 ON THE 1ST,BASEMENT AND CELLAR FLOOR TO BE COMBINED PER PROVISIONS OF TPPN 3 OF 1997. NO CHANGE IN USE, EGRESS OR OCCUPANCY."
Manhattan,1028797,55,WEST 76TH STREET,123068214,1,A2,N,10,10,No,RESID. BLDG - OLD CODE,RESID. BLDG - OLD CODE,4/7/2017 0:00,4/7/2017,Initial Permit,EW,Issued,Initial Permit,0,0,No,,,Y,1,"ARCHITECTURAL AND PLUMBING WORK PER PLANS. APARTMENTS 2A AND 4 ON THE 1ST,BASEMENT AND CELLAR FLOOR TO BE COMBINED PER PROVISIONS OF TPPN 3 OF 1997. NO CHANGE IN USE, EGRESS OR OCCUPANCY."
Manhattan,1028819,22,WEST 77 STREET,140848377,1,A2,N,40,40,No,RESID. BLDG - OLD CODE,RESID. BLDG - OLD CODE,6/7/2019 0:00,12/10/2019,Renewed,EW,Issued,Renewed,0,0,No,,,Y,40,"COMBINE &amp; REMOVE APTS 35 &amp; 36 ON THE 3RD FLR. NO CHANGE IN USE, EGRESS OR OCCUPANCY."
Manhattan,1028837,165,WEST 66TH STREET,123010829,1,A2,N,377,377,No,RESID. BLDG - OLD CODE,RESID. BLDG - OLD CODE,3/1/2017 0:00,4/10/2017,Renewed,EW,Issued,Renewed,0,0,No,,,Y,52,"FILING APPLICATION TO COMBINE APARTMENTS 17EF AND 17G 17TH FLOOR. NO CHANGE TO USE, EGRESS OR OCCUPANCY."
Manhattan,1028837,165,WEST 66 STREET,140316021,1,A2,N,377,377,No,RESID. BLDG - OLD CODE,RESID. BLDG - OLD CODE,7/2/2015 0:00,7/2/2015,Initial Permit,PL,Issued,Initial Permit,0,0,No,,,Y,52,COMBINE APARTMENTS 16L AND 16M. CREATE DOORWAY IN DEMISING PARTITION. ELIMINATE 16M KITCHENETTE. MINOR ALTERATION OF 16M BATHROOM AND CLOSETS (BOTH APTS).
Manhattan,1028840,150,COLUMBUS AVE,122663475,1,A2,N,143,143,No,RESIDENTIAL APT HOUSE,RESIDENTIAL APT HOUSE,3/17/2016 0:00,3/15/2016,Initial Permit,EW,Issued,Initial Permit,0,0,No,,,Y,12,"INTERIOR RENOVATION WITH PLUMBING &amp; PARTITION WORK ON 18TH FL. COMBINE APT#18A &amp; 18B TO ONE APT#18A/B. REFURBISH EXISTING WALL &amp; REPLACE EXISTING FLOOR WITH WOOD FLOOR. REMOVE PARTIAL EXISTING PARTITIONS, DOORS, A KITCHEN &amp; A W/D. INSTALL NEW PARTITIONS,DOORS &amp; CLOSET. RELOCATED A BATHROOM. NO CHANGE IN USE, EGRESS OR OXXUPANCY."
Manhattan,1028948,140,WEST 69TH STREET,120226549,1,A2,,112,112,No,RESIDENTIAL APT HOUSE,RESIDENTIAL APT HOUSE,12/8/2011 0:00,3/2/2015,Renewed,PL,Issued,Renewed,0,0,No,,,Y,10,PROPOSE TO SPLIT APARTMENT #117-C AND PART TO BE COMBINED WITH APARTMENT #117-A AND APARTMENT #117-B AND REMAINDER TO BR COMBINED WITH APARTMENT #118 FILED UNDER SEPARATE APPLICATION. NO CHANGE IN USE OR OCCUPANCY PROPOSED UNDER THIS APPLICATION.
Manhattan,1028948,140,WEST 69TH STREET,122698438,1,A2,N,112,112,No,RESIDENTIAL APT HOUSE,RESIDENTIAL APT HOUSE,4/19/2016 0:00,4/6/2016,Initial Permit,EW,Issued,Initial Permit,0,0,No,,,Y,10,"TO COMBINE APARTMENTS 105A &amp; 104A. REMOVE EXISTING KITCHENETTE. RENOVATE EXISTING BATHROOM AS SHOWN ON DRAWINGS FILED HEREWITH. NO CHANGE IN USE, EGRESS OR OCCUPANCY."
Manhattan,1028948,140,WEST 69TH STREET,123197414,1,A2,N,112,112,No,RESIDENTIAL APT HOUSE,RESIDENTIAL APT HOUSE,2/20/2018 0:00,2/13/2018,Initial Permit,EW,Issued,Initial Permit,0,0,No,,,Y,10,"APPLICATION FILED FOR INTERIOR RENOVATION OF NON LOAD BEARING, PARTITIONS, CEILINGS AND FINISHES ON THE PENTHOUSE LEVEL TO COMBINE APT PH8 &amp; PH9  AS PER PLANS FILED HEREWITH. NO CHANGE IN USE, EGRESS, OR OCCUPANCY."
Manhattan,1028950,155,WEST 68 STREET,123074733,1,A2,N,680,680,No,RESIDENTIAL APT HOUSE,RESIDENTIAL APT HOUSE,7/17/2017 0:00,7/12/2017,Initial Permit,EW,Issued,Initial Permit,0,0,No,,,Y,56,"APPLICATION BEING FILED TO COMBINE AND RENOVATE (2) EXISTING APARTMENTS, NO CHANGE IN USE, OCCUPANCY OR EGRESS."
Manhattan,1028950,155,WEST 68TH STREET,123844000,1,A2,N,680,680,No,RESID. BLDG - OLD CODE,RESID. BLDG - OLD CODE,1/15/2020 0:00,1/15/2020,Initial Permit,EW,Issued,Initial Permit,0,0,No,,,Y,56,"ARCHITECTURAL RENOVATIONS FOR APARTMENT 515/516 ON 5TH FLOOR. APARTMENT COMBINED PER TPPN 3/97 UNDER APPLICATION #102787227. NO CHANGE IN USE, EGRESS OR OCCUPANCY."
Manhattan,1028950,155,WEST 68TH STREET,140852487,1,A2,N,680,680,No,RESID. BLDG - OLD CODE,RESID. BLDG - OLD CODE,7/3/2019 0:00,7/3/2019,Initial Permit,EW,Issued,Initial Permit,0,0,No,,,Y,56,"COMBINED HEAT AND POWER INSTALLATION AND ASSOCIATED MECHANICAL WORK. NO CHANGE IN USE, EGRESS OR OCCUPANCY."
Manhattan,1029658,154,WEST 70 STREET,121802736,1,A2,,160,160,No,RESID. BLDG - OLD CODE,RESID. BLDG - OLD CODE,7/30/2014 0:00,9/18/2015,Renewed,PL,Issued,Renewed,0,0,No,,,Y,176,"RENOVATE EX. APARTMENTS @3 THRU 12 FL COMBINE APT AS PER PLANS MINOR PARTITIOS REPLACE EX. SINKS, TOILETS, TUBS &amp; SHOWERS W/NEW ON EX ROUGHING INSTALL NEW DISHWASHERS &amp; WASHING MACHINES. RELOCATE EX TOILETS.REPLACE EX. FLOOR FINISH PAINT THROUGHOUT   NO CHANGE IN USE, EGRESS OR OCCUPANCY. NO CHANGE OF HEIGHT OR BULK OR FLOOR AREA."
Manhattan,1029933,121,WEST 72 STREET,122362442,1,A2,N,88,88,No,RESID. BLDG - OLD CODE,RESID. BLDG - OLD CODE,7/7/2015 0:00,11/9/2015,eRenewed,EW,Issued,eRenewed,0,0,No,,,Y,12,"COMBINE UNITS 14C/12C AND 14E INTO ONE APARTMENT. RELOCATE &amp; REPLACE INTERIOR PARTITIONS, BATHROOMS, KITCHEN, PLUMBING FIXTURES. RECONFIGURE EXISTING CONVENIENCE STAIR."
Manhattan,1030014,105,WEST 73RD STREET,122648331,1,A2,N,38,38,No,RESID. BLDG - OLD CODE,RESID. BLDG - OLD CODE,2/2/2016 0:00,1/19/2016,Initial Permit,EW,Issued,Initial Permit,0,0,No,,,Y,38,"APPLICATION FILED FOR INTERIOR/EXTERIOR RENOVATION TO COMBINE APTS 1A &amp; 1B AS PER PLANS FILED HEREWITH. NO CHANGE IN USE, EGRESS, OR OCCUPANCY."
Manhattan,1030060,133,WEST   74 STREET,104435657,1,A1,,,13,No,RESID. BLDG - OLD CODE,RESID. BLDG - OLD CODE,4/7/2008 0:00,2/23/2016,Renewed,PL,Issued,Renewed,7200,0,No,,,Y,14,Combine a class 'A' apartment and a class 'B' room at front of second floor.
Manhattan,1030084,132,WEST 75 STREET,140373272,1,A2,N,9,9,No,RESID. BLDG - OLD CODE,RESID. BLDG - OLD CODE,11/17/2015 0:00,4/13/2018,eRenewed,PL,Issued,eRenewed,0,0,No,,,Y,7,REMODEL APT AT BASEMENT. REMODEL APT ON FIRST FLOOR. COMBINE AND REMODEL APTS 2F &amp; 2R ON THE SECOND FLOOR. COMBINE AND REMODEL APTS 3F &amp; 3R ON THE THIRD FLOOR. COMBINE AND REMODEL APTS 4F &amp; 4R ON THE FOURTH FLOOR.
Manhattan,1030112,161,WEST 75 STREET,122491268,1,A2,N,132,132,No,RESID. BLDG - OLD CODE,RESID. BLDG - OLD CODE,9/15/2015 0:00,9/15/2015,Initial Permit,PL,Issued,Initial Permit,0,0,No,,,Y,10,"COMBINE APARTMENTS 4E AND 4A, APARTMENT RENOVATION, THE PROPERTY IS NOT IN A SPECIAL FLOOD HAZARD AREA PER EFFECTIVE 2007 FIRM OR PRELIMINARY FLOOD MAPS RELEASED IN 2013, NO CHANGE TO USE, EXITS OR OCCUPANCY"
Manhattan,1030112,161,WEST 75TH STREET,122772534,1,A2,N,132,132,No,RESID. BLDG - OLD CODE,RESID. BLDG - OLD CODE,5/2/2016 0:00,4/27/2016,Initial Permit,EW,Issued,Initial Permit,0,0,No,,,Y,10,"COMBINE APARTMENTS 3B AND 3C AS PER PLANS AND TPPN 3/97. REMOVE NON-BEARING INTERIOR PARTITIONS INSTALL NEW NON-BEARING INTERIOR PARTITIONS AND PATCH CEILINGS AS REQUIRED. INSTALLATION OF NEW PLUMBING FIXTURES. NO CHANGE TO OCCUPANCY, USE, EGRESS OR BULK."
Manhattan,1030112,161,WEST 75TH STREET,140522058,1,A2,N,132,132,No,RESID. BLDG - OLD CODE,RESID. BLDG - OLD CODE,5/12/2017 0:00,2/17/2017,Initial Permit,EW,Issued,Initial Permit,0,0,No,,,Y,10,"FILING HEREWITH GENERAL CONSTRUCTION, PL/MECH WORK ASSOCIATED WITH THE EXTERIOR INSTALLATION OR REPLACEMENT OF NEW PTACS AT COMBINED APARTMENT 12D/E PURSUANT TO TPPN #03/97."
Manhattan,1030122,137,WEST 75 STREET,121015533,1,A1,Y,12,10,Yes,RESID. BLDG - OLD CODE,RESIDENTIAL: APARTMENT HOUSES,7/10/2012 0:00,7/13/2018,Renewed,AL,Issued,Renewed,0,0,No,,,Y,10,COMBINE CLASS 'B' ROOMS ON FOURTH FLOOR TO MAKE TWO CLASS 'A' APARTMENTS.
Manhattan,1030164,119,WEST 75 STREET,140449076,1,A2,N,9,9,No,RESID. BLDG - OLD CODE,RESID. BLDG - OLD CODE,4/12/2016 0:00,4/12/2016,Initial Permit,PL,Issued,Initial Permit,0,0,No,,,Y,10,"COMBINE APT 5F AND 5R ON THE FIFTH FLOOR. NO CHANGE TO USE, EGRESS OR OCCUPANCY."
Manhattan,1030188,172,WEST 77TH STREET,123399134,1,A2,N,19,19,No,RESID. BLDG - OLD CODE,RESID. BLDG - OLD CODE,,9/10/2018,Initial Permit,EW,Issued,Initial Permit,0,0,No,,,Y,18,"INTERIOR RENOVATION TO COMBINE APARTMENT 2A AND 2B INCLUDING CAPPING/REMOVING 1 KITCHER. NO CHANGE TO USE, EGRESS OR OCCUPANCY."
Manhattan,1030188,172,WEST 77 STREET,123674808,1,A2,N,19,19,No,RESID. BLDG - OLD CODE,RESID. BLDG - OLD CODE,6/24/2019 0:00,3/13/2019,Initial Permit,EW,Issued,Initial Permit,0,0,No,,,Y,18,"INTERIOR RENOVATION TO COMBINE APARTMENTS 2C AND 2D INCLUDING CAPPING AND REMOVING 1 KITCHEN. NO CHANGE TO USE, EGRESS OR OCCUPANCY"
Manhattan,1030203,123,WEST 77 STREET,123850920,1,A1,N,12,11,Yes,RESID. BLDG - OLD CODE,RESIDENTIAL: APARTMENT HOUSES,7/15/2019 0:00,7/11/2019,Initial Permit,AL,Issued,Initial Permit,6256,0,No,,,Y,12,REMODEL AND COMBINE APT 1B AND 1C ON THE BASEMENT LEVEL AND CREATE RECREATION ROOM AT CELLAR ACCESSORY TO THE SAME. NEW CO WILL BE OBTAINED.
Manhattan,1030260,118,WEST 79 STREET,122574482,1,A2,N,52,52,No,RESID. BLDG - OLD CODE,RESID. BLDG - OLD CODE,3/25/2016 0:00,7/5/2016,Renewed,EW,Issued,Renewed,0,0,No,,,Y,49,"COMBINE APARTMENTS 3A AND 3B. DEMOLITION OF INTERIOR NON-LOAD BEARING PARTITIONS, NEW PARTITIONS AND FINISHES AND REPLACE AND INSTALL NEW PLUMBING FIXTURES. NO CHNAGE IN USE, EGRESS OR OCCUPANCY."
Manhattan,1030261,124,WEST   79 STREET,104340090,1,A2,,,65,No,RESIDENTIAL APT HOUSE,,10/5/2007 0:00,6/18/2019,Renewed,PL,Issued,Renewed,0,0,No,,,Y,63,"COMBINE APARTMENTS 2B AND 2BN INTO ONE APARTMENT 2B.  MINOR PLUMBING REPLACEMENT AS SHOWN ON DRAWINGS FILED HEREWITH.  NO CHANGE IN USE, EGRESS OR OCCUPANCY."
Manhattan,1030261,124,WEST 79 STREET,140735426,1,A2,N,64,64,No,RESID. BLDG - OLD CODE,RESID. BLDG - OLD CODE,6/7/2018 0:00,2/1/2018,Initial Permit,EW,Issued,Initial Permit,0,0,No,,,Y,63,"COMBINE APTS PA &amp; PB ON THE PENTHOUSE LEVEL. NO CHANGE IN USE, EGRESS OR OCCUPANCY."
Manhattan,1030350,210,WEST 70TH STREET,122433848,1,A2,N,186,186,No,RESID. BLDG - OLD CODE,RESID. BLDG - OLD CODE,6/27/2016 0:00,6/27/2016,Initial Permit,PL,Issued,Initial Permit,0,0,No,,,Y,172,"COMBINE APT 506/507, 508/509, 806/807. DEMOLISH EXISTING NON LOAD BEARING PARTITIONS, CEILING AND DOORS. INSTALL NEW PARTITIONS AND MODIFY PLUMBING FIXTURES AS SHOWN IN PLANS. NO CHANGE IN EGRESS. NO CHANGE IN OCCUPANCY OR USE."
Manhattan,1030350,210,WEST 70TH STREET,122503576,1,A2,N,186,186,No,RESID. BLDG - OLD CODE,RESID. BLDG - OLD CODE,4/1/2016 0:00,3/16/2016,Initial Permit,EW,Issued,Initial Permit,0,0,No,,,Y,172,"RENOVATION OF APT 208 AND COMBINE APT 905/906. DEMOLIST EXISTING NON LOAD BEAR ING PARTITIONS, CEILING AND DOOR. INSTALL NEW PARTITIONS AND MODIFY PLUMBING FIXTURES AS SHOWN IN PLANS. NO CHANGE IN EGRESS. NO CHANGE IN OCCUPANCY OR USE."
Manhattan,1030350,210,WEST 70TH STREET,122529344,1,A2,N,186,186,No,RESID. BLDG - OLD CODE,RESID. BLDG - OLD CODE,6/27/2016 0:00,6/27/2016,Initial Permit,PL,Issued,Initial Permit,0,0,No,,,Y,172,"COMBINE APT# 609 &amp; 1109. DEMOLISH EXISTING NON LOAD BEARING PARTITIONS, CEILING AND DOORS. INSTALL NEW PARTITIONS AND MODIFY PLUMBING FIXTURES AS SHOWN IN PLANS. NO CHANGE IN EGRESS. NO CHANGE IN OCCUPANCY OR USE."
Manhattan,1030350,210,WEST 70TH STREET,140479006,1,A2,N,186,186,No,RESID. BLDG - OLD CODE,RESID. BLDG - OLD CODE,5/19/2016 0:00,4/28/2016,Initial Permit,EW,Issued,Initial Permit,0,0,No,,,Y,172,"COMBINE APT# 504, 505 AND RENOVATE APT# 1107 &amp; 1108. DEMOLISH EXISTING NON LOAD BEARING PARTITIONS, CEILING AND DOORS. INSTALL NEW PARTITIONS AND MODIFY PLUMBING FIXTURES AS SHOWN IN PLANS. NO CHANGE IN EGRESS. NO CHANGE IN OCCUPANCY OR USE."
Manhattan,1030350,210,WEST 70TH STREET,140555691,1,A2,N,186,186,No,RESID. BLDG - OLD CODE,RESID. BLDG - OLD CODE,10/24/2016 0:00,10/3/2016,Initial Permit,EW,Issued,Initial Permit,0,0,No,,,Y,172,"COMBINE APT# 602 AND 603. DEMOLISH EXISTING NON LOAD BEARING PARTITIONS, CEILING AND DOORS. INSTALL NEW PARTITIONS AND MODIFY PLUMBING FIXTURES AS SHOWN IN PLANS. NO CHANGE IN EGRESS. NO CHANGE IN OCCUPANCY OR USE."
Manhattan,1030350,210,WEST 70TH STREET,140819924,1,A2,N,186,186,No,RESID. BLDG - OLD CODE,RESID. BLDG - OLD CODE,12/6/2018 0:00,11/30/2018,Initial Permit,EW,Issued,Initial Permit,0,0,No,,,Y,172,"COMBINE APT 904 &amp; 904A AS PER BULLETIN # 3/97. DEMOLISH EXISTING NON LOAD BEARING PARTITIONS, CEILING AND DOORS. INSTALL NEW PARTITIONS AND MODIFY PLUMBING FIXTURES AS SHOWN IN PLANS. NO CHANGE IN EGRESS. NO CHANGE IN OCCUPANCY OR USE."
Manhattan,1030373,201,WEST 70TH STREET,121522762,1,A2,,384,384,No,RESID. BLDG - OLD CODE,RESID. BLDG - OLD CODE,2/18/2015 0:00,2/18/2015,Initial Permit,PL,Issued,Initial Permit,0,0,No,,,Y,378,"FILING TO COMBINE APTS 41G, H, AND K. APARTMENT CONBINATION TO COMPLY WITH TPP N 3 OF 97. WORK TO INCLUDE REMOVAL OF KITCHEN IN APTS.41G AND 41H, MINOR PARTI TION CHANGES, AND OTHER PLUMBING MODIFICATION-ALL AS PER PLANS FILED HEREWITH.   NO CHANGE IN USE, EGRES, OR OCCUPANCY UNDER THIS APPLICATION."
Manhattan,1030373,201,WEST 70 STREET,122372912,1,A2,N,396,396,No,RESIDENTIAL APT HOUSE,RESIDENTIAL APT HOUSE,8/4/2015 0:00,8/4/2015,Initial Permit,PL,Issued,Initial Permit,0,0,No,,,Y,378,FILED HEREWITH TO COMBINE APARTMENTS 29G AND 29H AND MINOR PLUMBING WORK.
Manhattan,1030373,201,WEST 70 STREET,123136971,1,A2,N,532,532,No,RESID. BLDG - OLD CODE,RESID. BLDG - OLD CODE,11/17/2017 0:00,11/17/2017,Initial Permit,PL,Issued,Initial Permit,0,0,No,,,Y,378,"COMBINE APTS. 31A &amp; 31B; REMOVE SECTION OF DEMISING WALL BETWEEN APTS., RENOVATE EXISTING KITCHEN 31B, REMOVE EXISTING KITCHEN 31A, RENOVATE BATHROOM  APT. 31A, CREATE NEW LAUNDRY RM IN KITCHEN LOCATION 31A, INSTALL NEW WOOD FLOORING, NEW SOFFITS &amp; LIGHT FIXTURES, MINOR MODIFICATIONS TO NON STRUCTURAL PARTITIONS. NO CHANGE TO USE, EGRESS, OCCUPANCY"
Manhattan,1030373,201,WEST 70TH STREET,123291035,1,A2,N,387,387,No,RESID. BLDG - OLD CODE,RESID. BLDG - OLD CODE,3/26/2018 0:00,3/20/2018,Initial Permit,EW,Issued,Initial Permit,1162,0,No,,,Y,378,"FILE TO COMBINE APARTMENTS 42A, 42B,&amp; A PORTION OF 42C AS PER TPPN #3/97 ON THE 41ST FLOOR. WORK INCLUDES REMOVAL &amp; INSTALLATION OF INTERIOR NON-LOAD BEARING PARTITIONS, DOORS,&amp; FINISH WORK. PLUMBING INCLUDES REMOVAL, RELOCATION, REPLACEMENT,&amp; INSTALLATION OF FIXTURES AS INDICATED ON PLANS FILED HEREWITH. NO CHANGE IN USE, EGRESS, OR OCCUPANCY."
Manhattan,1030373,201,WEST 70TH STREET,123739133,1,A2,N,365,365,No,RESIDENTIAL APT HOUSE,RESIDENTIAL APT HOUSE,11/12/2019 0:00,11/12/2019,Initial Permit,EW,Issued,Initial Permit,0,0,No,,,Y,378,"SEPARATION OF APTS. 39G &amp; 39H PREVIOUSLY COMBINED UNDER APPLICANT# 103415733. INTERIOR PARTITION AND FINISHES. NO CHANGE IN SUE, EGRESS OR OCCUPANCY."
Manhattan,1030390,240,WEST END AVENUE,123170736,1,A2,N,62,62,No,RESIDENTIAL APT HOUSE,RESIDENTIAL APT HOUSE,,11/21/2019,Renewed,EW,Issued,Renewed,0,0,No,,,Y,64,"FILING TO COMBINE OF APARTMENT 2C AND 2D ON THE 1ST FLOOR AS PER TPPN 3 OF 1997. NON-STRUCTURAL PARTITION DEMOLITION AND CONSTRUCTION WORK AS PER PLANS. MECHANICAL VENTILATION OF DRYER AND BATHROOM EXHAUST AS PER PLANS.  PLUMBING WORK AS PER PLANS.  NO CHANGE TO USE, EGRESS OR OCCUPANCY."
Manhattan,1030403,246,WEST END AVENUE,123239799,1,A2,N,102,102,No,RESID. BLDG - OLD CODE,RESID. BLDG - OLD CODE,1/31/2018 0:00,2/5/2019,Renewed,PL,Issued,Renewed,0,0,No,,,Y,17,"COMBINE APARTMENTS #1C AND #1D ON THE 1ST FLOOR. WORK INCLUDES NEW PARTITIONS, NEW FINISHES, NEW PLUMBING FIXTURES AND NEW LIGHTING. NO CHANGE IN USE, OCCUPANCY OR EGRESS."
Manhattan,1030436,260,WEST END AVENUE,121943950,1,A2,,80,80,No,RESID. BLDG - OLD CODE,RESID. BLDG - OLD CODE,7/31/2014 0:00,1/8/2015,Renewed,EW,Issued,Renewed,0,0,No,,,Y,3,"INTERIOR/EXTERIOR RENOVATION ON 15TH FL. AND PENTHOUSE LEVEL TO COMBINE APARTMENTS 16A AND 16C, AS SHOWN ON PLANS.  NO CHANGE IN USE, OCCUPANCY OR EGRESS."
Manhattan,1030505,269,WEST 72 STREET,122638547,1,A2,N,58,58,No,RESID. BLDG - OLD CODE,RESID. BLDG - OLD CODE,3/17/2016 0:00,3/17/2016,Initial Permit,PL,Issued,Initial Permit,0,0,No,,,Y,7,"COMBINE APT.6C &amp; 6D. WORK TO INCLUDE MINOR MODIFICATION OF NON LOAD BEARING INTERIOR PARTITIONS TO EFFECT COMBINATION. INSTALL NEW FINISHES. REMOVE KITCHEN APPLIANCES &amp; CAP LINES AS REQUIRED IN KITCHEN OF FORMER APT.6D. NO CHANGE TO EXISTING USE, OCCUPANCY OR EGRESS."
Manhattan,1030507,253,WEST 72 ST,122831702,1,A2,N,259,259,No,RESID. BLDG - OLD CODE,RESID. BLDG - OLD CODE,10/19/2016 0:00,10/19/2016,Initial Permit,PL,Issued,Initial Permit,0,0,No,,,Y,260,"RESPECTFULLY REQUEST TO RENOVATE AND COMBINE EXISTING UNITS 2101 AND 2102. RENOVATION TO INCLUDE LIMITED REMOVAL OF INTERIOR NON LOAD-BEARING PARTITIONS, FINISHES, APPLIANCES &amp; PLUMBING FIXTURES.   INSTALLATION OF NEW FINISHES, APPLIANCES AND PLUMBING FIXTURES, NEW POWDER ROOM AND LAUNDRY. NO CHANGE IN USE, EGRESS, OR OCCUPANCY."
Manhattan,1030507,253,WEST 72 STREET,122895661,1,A2,N,259,259,No,RESIDENTIAL APT HOUSE,RESIDENTIAL APT HOUSE,10/19/2016 0:00,9/22/2016,Initial Permit,EW,Issued,Initial Permit,0,0,No,,,Y,260,"COMBINE APARTMENTS 1010 AND 1011, INTERIOR RENOVATION, MODIFY KITCHEN,AND BATHROOM. NO CHANGE IN USE, EGRESS OR OCCUPANCY."
Manhattan,1030507,253,WEST 72 STREET,123149280,1,A2,N,256,256,No,RESID. BLDG - OLD CODE,RESID. BLDG - OLD CODE,2/9/2018 0:00,2/9/2018,Initial Permit,EW,Issued,Initial Permit,0,0,No,,,Y,260,COMBINE APARTMENTS 610 AND 611 WITH INTERIOR RENOVATIONS.
Manhattan,1030544,2109,BROADWAY,120996538,1,A2,,409,409,No,RESIDENTIAL: APARTMENT HOUSES,RESIDENTIAL: APARTMENT HOUSES,9/10/2012 0:00,1/30/2015,Renewed,EW,Issued,Renewed,0,0,No,,,Y,391,"COMBINE APARTMENTS 16-109, 17-105 AND 17-129 PER TPPN#3.1997. REMOVE AND INSTALL INTERIOR NON-BEARING PARTITIONS, HUNG CEILINGS, DOORS, MILLWORK, CABINETRY AND FINISH FLOORING THROUGHOUT; INSTALL NEW CONVENIENCE STAIR.  NO CHANGE IN ZONING, USE, EGRESS OR OCCUPANCY PROPOSED."
