Manhattan,1057188,310,RIVERSIDE DRIVE,122709168,1,A2,N,324,324,No,RESID. BLDG - OLD CODE,RESID. BLDG - OLD CODE,10/5/2017 0:00,10/3/2017,Initial Permit,EW,Issued,Initial Permit,0,0,No,,,Y,23,COMBINE 2 STUDIO APARTMENTS INTO A ONE BEDROOM.  CREATE OPENING FOR DOOR TO ADJOING APARTMENTS AND REMOVE KITCHEN IN ONE UNIT.
Manhattan,1057188,310,RIVERSIDE DRIVE,123028945,1,A2,N,330,330,No,RESID. BLDG - OLD CODE,RESID. BLDG - OLD CODE,4/25/2017 0:00,11/3/2017,Renewed,EW,Issued,Renewed,0,0,No,,,Y,23,"ARCHITECTURAL AND PLUMBING WORK FOR RENOVATIONS AND COMBINATION OF APARTMENT 1209 AND 1206/1207/1208 ON 12TH FLOOR. APARTMENTS TO COMBINED PER TPPN 3 OF 1997. NO CHANGE IN USE, EGRESS OR OCCUPANCY."
Manhattan,1057189,321,WEST  103 STREET,110229832,1,A2,,9,9,No,RESID. BLDG - OLD CODE,RESID. BLDG - OLD CODE,8/6/2008 0:00,7/3/2018,Renewed,PL,Issued,Renewed,0,0,No,,,Y,8,"COMBINE AND REMODEL FRONT AND REAR APARTMENTS ON THE SECOND FLOOR. NO CHANGE IN USE, EGRESS OR OCCUPANCY."
Manhattan,1057189,321,WEST 103 STREET,140768792,1,A2,N,7,7,No,RESID. BLDG - OLD CODE,RESID. BLDG - OLD CODE,6/6/2018 0:00,6/3/2018,Initial Permit,EW,Issued,Initial Permit,0,0,No,,,Y,8,COMBINE AND REMODEL FRONT AND REAR APARTMENTS ON THE BASEMENT LEVEL. NO CHANGE IN USE EGRESS OR OCCUPANCY.
Manhattan,1057207,315,RIVERSIDE DR,140566787,1,A2,N,92,92,No,RESID. BLDG - OLD CODE,RESID. BLDG - OLD CODE,1/11/2017 0:00,12/9/2016,Initial Permit,EW,Issued,Initial Permit,0,0,No,,,Y,9,"COMBINE APT 6B &amp; 6C INTO ONE APT WITH PARTITION WORK &amp; WITH REMOVING KITCHEN AT APT 6C. NO CHANGE IN USE, MEANS OF EGRESS, OCCUPANCY , OR  MEANS OF EGRESS IN THIS APPLICATION ."
Manhattan,1057223,318,WEST 105 STREET,110452974,1,A1,,10,10,No,RESID. BLDG - OLD CODE,RESIDENTIAL: APARTMENT HOUSES,3/13/2009 0:00,10/27/2017,Renewed,AL,Issued,Renewed,0,0,No,,,Y,10,"COMBINE THREE APARTMENTS ON THE 1ST FLOOR INTO TWO AND ADD RECREATION ROOMS IN CELLAR CONNECTED TO SAME. SPLIT EXISTING APARTMENT ON THE 2ND FLOOR INTO TWO. ALL WORK TO BER FILED UNDER ALTERATION TYPE 2 APPLICATION , JOB NUMBER 104797267."
Manhattan,1057225,325,RIVERSIDE DRIVE,140820805,1,A2,N,53,53,No,RESID. BLDG - OLD CODE,RESID. BLDG - OLD CODE,4/1/2019 0:00,4/1/2019,Initial Permit,PL,Issued,Initial Permit,0,0,No,,,Y,10,"REFILE APPLICATION # 101371267. COMBINE AND REMODEL APTS 73 &amp; 74 ON SEVENTH FLOOR. NO CHANGE IN USE, EGRESS OR OCCUPANCY."
Manhattan,1057229,321,WEST 105 STREET,140784630,1,A2,N,15,15,No,RESID. BLDG - OLD CODE,RESID. BLDG - OLD CODE,8/7/2019 0:00,8/7/2019,Initial Permit,PL,Issued,Initial Permit,0,0,No,,,Y,15,"COMBINE AND REMODEL APTS 2A AND 2B ON THE SECOND FLOOR. NO CHANGE IN USE, EGRESS OR OCCUPANCY."
Manhattan,1057234,309,WEST 105 STREET,140581038,1,A2,N,7,7,No,RESID. BLDG - OLD CODE,RESID. BLDG - OLD CODE,3/3/2017 0:00,12/6/2016,Initial Permit,EW,Issued,Initial Permit,0,0,No,,,Y,6,COMBINE AND REMODEL FRONT AND REAR APARTMENTS ON THE SECOND FLOOR. NO CHANGE IN USE EGRESS OR OCCUPANCY.
Manhattan,1057285,300,WEST 108TH STREET,122803341,1,A2,N,72,72,No,RESID. BLDG - OLD CODE,RESID. BLDG - OLD CODE,11/21/2016 0:00,11/21/2016,Initial Permit,EW,Issued,Initial Permit,0,0,No,,,Y,8,COMBINE APTS 12B AND 13B. ACCORDING TO TPPN 3/97. INSTALL SPIRAL STAIR BETWEEN APTS.NO CHANGE TO USE OCCUPANCY OR EGRESS.
Manhattan,1057317,610,WEST 110TH STREET,123411487,1,A2,N,73,73,No,RESID. BLDG - OLD CODE,RESID. BLDG - OLD CODE,5/11/2018 0:00,5/8/2018,Initial Permit,EW,Issued,Initial Permit,1865,0,No,,,Y,9,"FILING HEREWITH TO COMBINE PH5 &amp; PH6 AS PER TPPN 3 OF 1997. REMOVE ONE KITCHEN. REMOVAL AND CONSTRUCTION OF NON-STRUCTURAL PARTITIONS AS PER ARCH DRAWINGS. PLUMBING WORK AS PER PL PLANS. INSTALL WINDOWS AND DOORS WITHIN EXISTING MASONRY OPENINGS.NO CHANGE TO USE, EGRESS OR OCCUPANCY.INSTALLATION OF CENTRAL AIR AND EXHAUST DUCTS AS PER MH DRAWINGS"
Manhattan,1057345,410,RIVERSIDE DRIVE,123256056,1,A2,N,69,69,No,RESID. BLDG - OLD CODE,RESID. BLDG - OLD CODE,4/24/2018 0:00,4/18/2018,Initial Permit,EW,Issued,Initial Permit,0,0,No,,,Y,5,"INTERIOR CONSTRUCTION TO COMBINE APTS.#61 &amp; #64 ON 6TH FLOOR. NON-STRUCTURAL DEMOLITION; NEW PARTITIONS &amp; DOORS AS SHOWN; REPLACE PLUMBING FIXTURES, FINISHES, TILEWORK, KITCHEN CABINETS. NO CHANGE TO USE, EGRESS OR OCCUPANCY."
Manhattan,1057350,601,WEST 113 STREET,121831278,1,A2,,131,131,No,RESID. BLDG - OLD CODE,RESID. BLDG - OLD CODE,5/30/2014 0:00,11/10/2015,Renewed,EW,Issued,Renewed,0,0,No,,,Y,11,"INTERIOR CONSTRUCTION ON 12TH FLOOR TO COMBINE APTS. #12B &amp; #12K. NON-STRUCTURAL DEMOLITION, NEW PARTITIONS, DOORS, PLUMBING FIXTURES, FINISHES AS SHOWN."
Manhattan,1057386,435,RIVERSIDE DRIVE,122385579,1,A2,N,40,40,No,RESID. BLDG - OLD CODE,RESID. BLDG - OLD CODE,2/16/2016 0:00,6/26/2015,Initial Permit,EW,Issued,Initial Permit,0,0,No,,,Y,2,"COMBINE APARTMENTS #111 &amp; #114 ON 11TH FLOOR. NON-STRUCTURAL DEMOLITION; REPAIR WALLS &amp; DOORS. NEW PARTITIONS, PLUMBING FIXTURES, FINISHES, TILEWORK, KITCHEN CABINETS"
Manhattan,1057386,435,RIVERSIDE DRIVE,122605225,1,A2,N,40,40,No,RESID. BLDG - OLD CODE,RESID. BLDG - OLD CODE,,1/22/2016,Initial Permit,EW,Issued,Initial Permit,0,0,No,,,Y,2,"INTERIOR RENOVATION TO APT.#54 ON 5TH FLOOR TO COMBINE EXISTING UNITS #52 &amp; #54. REPAIR WALLS &amp; DOORS AS SHOWN; NEW PARTITIONS, PLUMBING FIXTURES, FINISHES, TILEWORK. NON-STRUCTURAL DEMOLITION. NO CHANGE TO USE, EGRESS OR OCCUPANCY."
Manhattan,1057386,435,RIVERSIDE DRIVE,123040869,1,A2,N,40,40,No,RESID. BLDG - OLD CODE,RESID. BLDG - OLD CODE,,5/11/2017,Initial Permit,EW,Issued,Initial Permit,0,0,No,,,Y,2,"INTERIOR RENOVATION ON 10TH FLOOR TO COMBINE APTS #101 &amp; #102.IN COMPLIANCE WITH THE TPPN#3/97.NON-STRUCTURAL DEMOLITON;NEW PARTITIONS &amp; DOORS AS SHOWN; NEW PLUMBING FIXTURES, FINISHES, TILEWORK, KITCHEN CABINETS. NEW CENTRAL AIR CONDITIONING. NO CHANGE TO USE, EGRESS OR OCCUPANCY."
Manhattan,1057386,435,RIVERSIDE DRIVE,123205218,1,A2,N,40,40,No,RESID. BLDG - OLD CODE,RESID. BLDG - OLD CODE,10/2/2018 0:00,5/18/2018,Initial Permit,EW,Issued,Initial Permit,1026,0,No,,,Y,2,"INTERIOR RENOVATION TO COMBINE APTS. #62 &amp; #64 ON 6TH FLOOR. NON-STRUCTURAL DEMOLITION; REPAIR PARTITIONS &amp; DOORS AS SHOWN; REPLACE PLUMBING FIXTURES, FINISHES, TILEWORK, KITCHEN CABINETS. NO CHANGE TO USE, EGRESS OR OCCUPANCY."
Manhattan,1057537,151,WEST 119 STREET,123412379,1,A2,N,8,8,No,RESID. BLDG - OLD CODE,RESID. BLDG - OLD CODE,6/1/2018 0:00,5/29/2018,Initial Permit,EW,Issued,Initial Permit,0,0,No,,,Y,6,"HEREWITH FILE PLANS TO RESTORE THE FOUR (4) DWELLING UNITS THAT WERE PREVIOUSLY COMBINED INTO TWO UNITS UNDER APPLICATION #103423190 CITING TPPN3/97. THE WORK IS TO RE-ESTABLISH APARTMENT 1R AND 1F, 2R AND 2F; TO RE-ESTABLISH THE DEMISING PARTITIONS; AND INSTALL NEW FINISHES. NO CHANGE TO USE,EGRESS, OR OCCUPANCY"
Manhattan,1057559,195,LENOX AVE,123703741,1,A2,N,4,4,No,RESID. BLDG - OLD CODE,RESID. BLDG - OLD CODE,3/2/2020 0:00,3/2/2020,Initial Permit,EW,Issued,Initial Permit,0,0,No,,,Y,5,"STRUCTURAL WORK TO COMBINE AND RECONFIGURE APARTMENTS ON 1ST AND 2ND FLOORS. NO CHANGE IN USE, EGRESS OR OCCUPANCY."
Manhattan,1057559,195,LENOX AVENUE,123750164,1,A1,Y,5,4,Yes,RESID. BLDG - OLD CODE,RESIDENTIAL: APARTMENT HOUSES,1/7/2020 0:00,1/7/2020,Initial Permit,AL,Issued,Initial Permit,6955,0,No,,,Y,5,ARCHITECTURAL RENOVATIONS TO COMBINE AND RECONFIGURE APARTMENTS ON 1ST AND 2ND FLOORS.
Manhattan,1058384,2166,FREDERICK DOUGLAS BLVD,110416210,1,A1,Y,64,62,Yes,RESID. BLDG - OLD CODE,RESIDENTIAL: APARTMENT HOUSES,12/4/2008 0:00,7/9/2019,Renewed,AL,Issued,Renewed,0,0,No,,,Y,50,THIS CERTIFICATE SHALL ALSO BE CONSIDERED A CERTIFICATE OF COMPLIANCE OR OCCUPANCY UNDER SECTION 301 OF THE MULTIPLE DWELLING LAW. CO # 024417 OF 02/07/1939 AND CO # 052370 OF 06/08/1960 HAVE BEEN COMBINED TOGETHER TO CORRECT TOTAL NUMBER OF RESIDENTIAL UNITS.
Manhattan,1058850,236,WEST 135 STREET,123787731,1,A2,N,29,29,No,RESIDENTIAL APT HOUSE,RESIDENTIAL APT HOUSE,10/17/2019 0:00,10/17/2019,Initial Permit,EW,Issued,Initial Permit,0,0,No,,,Y,28,"GENERAL CONSTRUCTION TO COMBINE APT 5E AND 5F AT 5TH FLOOR AND RENAME TO APT 5EF. WORK WILL INCLUDE NEW PARTITIONS &amp; FINISHES. PLUMBING WILL BE FILED UNDER A SEPARATE APPLICATION. NO CHANGE IN USE, EGRESS, OR OCCUPANCY UNDER THIS FILING."
Manhattan,1059146,504,MANHATTAN AVE,122274190,1,A1,Y,10,10,No,RESID. BLDG - OLD CODE,RESIDENTIAL: APARTMENT HOUSES,5/3/2016 0:00,4/27/2016,Initial Permit,AL,Issued,Initial Permit,0,0,No,,,Y,10,HEREWITH FILING TO COMBINE CELLAR APARTMENT WITH APARTMENT 1F ON THE FIRST FLOOR.
Manhattan,1059391,341,ST NICHOLAS AVE,122874791,1,A2,N,41,41,No,RESIDENTIAL APT HOUSE,RESIDENTIAL APT HOUSE,2/8/2017 0:00,12/8/2016,Initial Permit,EW,Issued,Initial Permit,0,0,No,,,Y,40,"PROPOSE TO GUT RENOVATE &amp; COMBINE APTS, REPLACE BATH FIXT. &amp; FINISHES, KIT. FIXT. &amp; CABINETS, REMOVE ONE KITCHEN."
Manhattan,1059391,341,ST. NICHOLAS AVENUE,123390810,1,A2,N,41,41,No,RESIDENTIAL APT HOUSE,RESIDENTIAL APT HOUSE,7/23/2018 0:00,7/23/2018,Initial Permit,PL,Issued,Initial Permit,0,0,No,,,Y,40,"COMBINE FOURTH FLOOR APT. 45 &amp; APT.46 INTO ONE APARTMENT WITH PARTITION AND PLUMBING WORKS. NO CHANGE OF USE, EGRESS OR OCCUPANCY."
Manhattan,1059515,423,WEST 120 STREET,122078660,1,A1,,81,79,Yes,RESID. BLDG - OLD CODE,RESIDENTIAL: APARTMENT HOUSES,,7/1/2015,Initial Permit,AL,Issued,Initial Permit,0,0,No,,,Y,4,"COMBINE APARTMENTS 7 AND 8 ON FIRST FLOOR TO BECOME COLLEGE OFFICES. REMOVE EXISTING PARTITIONS &amp; PLUMBING FIXTURES. INSTALL NEW PARTITIONS, DOORS, CEILING, PLUMBING FIXTURES AND MECHANICAL EQUIPMENT."
Manhattan,1059596,25,ST NICHOLAS TERRACE,123740265,1,A2,N,55,55,No,RESID. BLDG - OLD CODE,RESID. BLDG - OLD CODE,11/4/2019 0:00,11/4/2019,Initial Permit,EW,Issued,Initial Permit,0,0,No,,,Y,55,"GENERAL CONSTRUCTION TO COMBINE APT 28 AND 29 AT 2ND FLOOR AND RENAME TO 28AB. WORK WILL INCLUDE NEW PARTITIONS &amp; FINISHES. PLUMBING WILL BE FILED UNDER A SEPARATE APPLICATION. NO CHANGE IN USE, EGRESS, OR OCCUPANCY UNDER THIS FILING."
Manhattan,1059817,440,RIVERSIDE DRIVE,122609926,1,A2,N,103,103,No,RESIDENTIAL APT HOUSE,RESIDENTIAL APT HOUSE,4/4/2016 0:00,3/4/2016,Initial Permit,EW,Issued,Initial Permit,0,0,No,,,Y,102,"COMBINE APT # 25 AND # 26 INTO ONE AS PER PLANS; REMOVE NON LOAD BEARING PARTITIONS, REMOVE KITCHEN IN APT # 25 AND CAP LINES, REPLACE PLUMBING FIXTURES IN BATHROOM, NEW CLOSETS. NO CHANGE IN USE, EGRESS OR OCCUPANCY."
Manhattan,1059817,440,RIVERSIDE DRIVE,122898631,1,A2,N,106,106,No,RESID. BLDG - OLD CODE,RESID. BLDG - OLD CODE,11/16/2016 0:00,11/16/2016,Initial Permit,EW,Issued,Initial Permit,0,0,No,,,Y,102,"COMBINE APT.#45 WITH APT.#46 IN COMPLIANCE WITH TTPN 3/97 (NO CHANGE TO CERTIFICATE OF OCCUPANCY). PERFORM PARTITION DEMOLITION AND NEW PARTITION WORK, PERFORM ELECTRICAL WORK AND REPLACE WINDOWS. PLUMBING WORK AND MECHANICAL WORK TO BE FILED UNDER SEPARATE APPLICATION. NO CHANGE TO USE, OCCUPANCY, EGRESS OR FIRE PROTECTION."
Manhattan,1059831,452,RIVERSIDE DRIVE,121904706,1,A2,,54,54,No,RESID. BLDG - OLD CODE,RESID. BLDG - OLD CODE,5/22/2014 0:00,1/14/2016,Renewed,EW,Issued,Renewed,0,0,No,,,Y,7,"INTERIOR CONSTRUCTION TO ON 6TH FLOOR TO COMBINE APTS. #64 &amp; 66. NON-STRUCTURAL DEMOLITION; NEW WALLS, DOORS; REPAIR FLOORS, CEILING, TRIM AS SHOWN ON PLANS. REPLACE PLUMBING FIXTURES &amp; KITCHEN CABINETS AS SHOWN ON PLANS."
Manhattan,1059831,452,RIVERSIDE DRIVE,121911208,1,A2,,54,54,No,RESID. BLDG - OLD CODE,RESID. BLDG - OLD CODE,5/22/2014 0:00,3/9/2018,Renewed,PL,Issued,Renewed,0,0,No,,,Y,7,"INTERIOR CONSTRUCTION TO ON 8TH FLOOR TO COMBINE APTS. #81 &amp; 85. NON-STRUCTURAL DEMOLITION; NEW WALLS, DOORS; REPAIR FLOORS, CEILING, TRIM AS SHOWN ON PLANS. REPLACE PLUMBING FIXTURES &amp; KITCHEN CABINETS AS SHOWN ON PLANS."
Manhattan,1059831,452,RIVERSIDE DRIVE,122445737,1,A2,N,54,54,No,RESID. BLDG - OLD CODE,RESID. BLDG - OLD CODE,,7/22/2015,Initial Permit,EW,Issued,Initial Permit,0,0,No,,,Y,7,"COMBINE APARTMENTS 62,64,66 INTO ONE APARTMENT. REMOVE ALL INTERIOR PARTITIONS, PLUMBING FIXTURES &amp; FINISHES. INSTALL NEW PARTITIONS, CABINETRY, FLOORING, FINISHES, PLUMBING FIXTURES, DUCTWORK, HVAC UNITS."
Manhattan,1059945,575,RIVERSIDE DRIVE,123123878,1,A2,N,42,42,No,RESID. BLDG - OLD CODE,RESID. BLDG - OLD CODE,10/31/2017 0:00,5/23/2018,Renewed,EW,Issued,Renewed,0,0,No,,,Y,8,"COMBINE APARTMENTS 61 &amp; 62.  CAP AND REMOVE KITCHEN IN 62 AND REPLACE WITH POWDER ROOM.  RENOVATE MASTER BATH.  NO CHANGE TO USE, OCCUPANCY OR EGRESS."
Manhattan,1062622,452,W 164 ST,123800734,1,A2,N,20,20,No,RESID. BLDG - OLD CODE,RESID. BLDG - OLD CODE,10/1/2019 0:00,10/1/2019,Initial Permit,EW,Issued,Initial Permit,0,0,No,,,Y,20,"COMBINE EXISTING APARTMENT #43 AND #44 ON FOURTH FLOOR AS PER PLANS SUBMITTED. NO CHANGE IN USE, EGRESS, OCCUPANCY."
Manhattan,1063086,1238,ST NICHOLAS AVENUE,121722724,1,A1,Y,40,38,Yes,RESID. BLDG - OLD CODE,RESIDENTIAL: APARTMENT HOUSES,,8/23/2016,Renewed,AL,Issued,Renewed,0,0,No,,,Y,40,FILING TO COMBINE THREE RETAILS STORES AND TWO APARTMENTS AT FIRST FLOOR INTO A RETAIL STORE WITH ACCESSORY STORAGE AT CELLAR LEVEL.
Manhattan,1063252,790,RIVERSIDE DRIVE,122657339,1,A2,N,202,202,No,RESID. BLDG - OLD CODE,RESID. BLDG - OLD CODE,6/8/2016 0:00,4/18/2016,Initial Permit,EW,Issued,Initial Permit,0,0,No,,,Y,34,"INTERIOR RENOVATION AND COMBINATION OF EXISTING CO-OP APARTMENTS #6M AND #6N. WORK TO INCLUDE NON-STRUCTURAL DEMOLITION, GENERAL CONSTRUCTION AND PLUMBING MODIFICATIONS, AS PER PLANS FILED HEREWITH. APARTMENTS COMBINED IN COMPLIANCE WITH TPPM 3/97. NO CHANGE IN USE, EGRESS OR OCCUPANCY."
Manhattan,1063300,158-18,RIVERSIDE DRIVE WEST,122185973,1,A2,,244,244,No,RESID. BLDG - OLD CODE,RESID. BLDG - OLD CODE,2/24/2015 0:00,2/24/2015,Initial Permit,PL,Issued,Initial Permit,0,0,No,,,Y,243,"RENOVATION AND COMBINATION OF COOP APTS #6E AND 6FG. WORK TO INCLUDE NON-STRUC TURAL DEMOLITION, GENERAL CONSTRUCTION: REMOVAL OF CONVENIENCE OPENING BETWEEN APTS 6FG AND 6H; AND PLUMBING MODIFICATION AS PER  PLANS FILED HEREWITH. APARTMENTS COMBINED IN COMPLIANCE WITH TPPN 3/87. NO CHANGE IN USE , EGRESS, O R OCCUPANCY."
Manhattan,1063586,480,WEST 187 STREET,123862935,1,A2,N,65,65,No,RESIDENTIAL APT HOUSE,RESIDENTIAL APT HOUSE,4/30/2019 0:00,4/30/2019,Initial Permit,EW,Issued,Initial Permit,0,0,No,,,Y,67,"PROPOSED OPENING IN LOAD BEARING MASONRY WALL TO COMBINE APARTMENTS 3B AND 3C. NO CHANGE TO BULK, EGRESS, USE OR OCCUPANCY"
Manhattan,1064058,4500,BROADWAY,123531213,1,A2,N,73,73,No,RESID. BLDG - OLD CODE,RESID. BLDG - OLD CODE,8/23/2018 0:00,8/14/2018,Initial Permit,EW,Issued,Initial Permit,0,0,No,,,Y,73,"ALT-2 FILED TO COMBINE EXISTING COMMERCIAL STORES TO EXPAND EXISTING DELI INCLUDING NEW STORE FRONT. CONSTRUCTION AND PLUMBING AS PER FILED DRAWINGS. FIRE SUPPRESSION SYSTEM TO BE FILED SEPARATE. NO CHANGE IN USE, EGRESS OR OCCUPANCY."
Manhattan,1064274,452,FT WASHINGTON AVE,122493970,1,A2,N,54,54,No,RESIDENTIAL APT HOUSE,RESIDENTIAL APT HOUSE,12/24/2015 0:00,6/13/2019,Renewed,PL,Issued,Renewed,0,0,No,,,Y,53,"PROPOSE TO COMBINE APTS 24 &amp; 29 -ELIMINATE APT 29 KITCHEN AND GUT RENOVATE APARTMENTS. REPLACE INTERIOR PARTITION FINISHES, REPLACE KIT. FIXT. &amp; CABINETS, REPLACE CEILING &amp; WALLS &amp; FLOOR SUB/FIN. FLOORING."
Manhattan,1064274,452,FT WASHINGTON AVE,123752965,1,A2,N,54,54,No,RESIDENTIAL APT HOUSE,RESIDENTIAL APT HOUSE,10/23/2019 0:00,10/23/2019,Initial Permit,PL,Issued,Initial Permit,0,0,No,,,Y,53," PROPOSE TO COMBINE APTS 64 &amp; 69 INTO ONE APT., REPLACE FINSIHES, REMOVE ONE KIT.,  REPLACE BATH &amp; KIT. FIXTURES &amp; CABINETS."
Manhattan,1064274,452,FT WASHINGTON AVE,123752974,1,A2,N,54,54,No,RESIDENTIAL APT HOUSE,RESIDENTIAL APT HOUSE,9/13/2019 0:00,9/13/2019,Initial Permit,EW,Issued,Initial Permit,0,0,No,,,Y,53,"PROPOSE TO RENOVATE APTS 48 &amp; 45 AND TO COMBINE THEM INTO ONE APT. 48.,REPLACE FINISHES, BATH &amp; KT. FXTURES,7 CABINETS, REMOVE APT. 48 KITCHEN."
Manhattan,1064274,452,FT WASHINGTON AVE,123800379,1,A2,N,54,54,No,RESIDENTIAL APT HOUSE,RESIDENTIAL APT HOUSE,9/13/2019 0:00,9/13/2019,Initial Permit,EW,Issued,Initial Permit,0,0,No,,,Y,53,"PROPOSE TO COMBINE APTS 55 &amp; 58 AND TO GUT RENOVATE, REPLACE FINISHES, BATH &amp; KITCHEN FIXTURES."
Manhattan,1064274,452,FT WASHINGTON AVE,123800388,1,A2,N,54,54,No,RESIDENTIAL APT HOUSE,RESIDENTIAL APT HOUSE,10/16/2019 0:00,10/16/2019,Initial Permit,EW,Issued,Initial Permit,0,0,No,,,Y,53,"PROPOSE TO COMBINE APTS 35 &amp; 38, AND GUT RENOVATE, REPLACE FINISHES &amp; BATH &amp; KITCHEN FIXTURES."
Manhattan,1064354,187,PINEHURST AVENUE,122702753,1,A2,N,49,49,No,RESID. BLDG - OLD CODE,RESID. BLDG - OLD CODE,7/21/2017 0:00,7/21/2017,Initial Permit,PL,Issued,Initial Permit,0,0,No,,,Y,49,"COMBINE EXISTING APARTMENT 1I WITH NEW APARTMENT 1H. KITCHEN IN 1H WILL BE DEMOLISHED AND TURNED INTO PART CLOSET/BEDROOM. BATHROOM FIXTURES IN 1H WILL BE REPLACED IN PLACE. NO CHANGE TO USE, OCCUPANCY, OR EGRESS. COMBINE APPTS AS PER COMPLIANCE WITH TPPN3/97."
Manhattan,1064400,45,OVERLOOK TERRACE,123580099,1,A2,N,51,51,No,RESIDENTIAL: APARTMENT HOUSES,RESIDENTIAL: APARTMENT HOUSES,4/1/2019 0:00,3/25/2019,Initial Permit,EW,Issued,Initial Permit,0,0,No,,,Y,3,FILING AND OBTAINING APPROVAL TO COMBINE APARTMENT 6A AND 6J AS PER DRAWINGS. NO CHANGE IN USE EGRESS OR OCCUPANCY.
Manhattan,1064403,44,BENNETT AVENUE,140731689,1,A2,N,66,66,No,RESIDENTIAL APT HOUSE,RESIDENTIAL APT HOUSE,2/6/2018 0:00,6/10/2019,Renewed,PL,Issued,Renewed,0,0,No,,,Y,65,"HEREWITH FILING APPLICATION TO COMBINE APT 2C &amp; 2D &amp; TO RENOVATE APT 6D. NO CHANGE IN USE, EGRESS OR OCCUPANCY."
Manhattan,1065004,55,PARK TERRACE EAST,122972587,1,A2,N,78,78,No,RESID. BLDG - OLD CODE,RESID. BLDG - OLD CODE,12/30/2016 0:00,12/20/2016,Initial Permit,EW,Issued,Initial Permit,0,0,No,,,Y,1,"INTERIOR RENOVATION TO COMBINE APARTMENT NOS. B-33 AND B-34 AS PER TPPN #3/97. NO CHANGE IN USE, OCCUPANCY, OR MEANS OF EGRESS."
Manhattan,1065004,57,PARK TERRACE EAST,123396057,1,A2,N,89,89,No,RESID. BLDG - OLD CODE,RESID. BLDG - OLD CODE,12/11/2018 0:00,12/11/2018,Initial Permit,EW,Issued,Initial Permit,0,0,No,,,Y,1,"APPLICATION FILED TO  COMBINE APARTMENTS B55 &amp; B56 UNDER TPPN 3/97- NON-BEARING INTERIOR PARTITIONS MODIFICATIONS WITH NEW FINISHES THAT INCLUDE CEILING REPAIR, APT B55 CAP &amp; REMOVE KITCHEN PLUMBING FIXTURES AS PER THE PLANS FILED HEREWITH. NO CHANGE TO OCCUPANCY, USE, OR EGRESS. PL WORK TYPE WITHDRAWN BY APPLICANT'S REQUEST"
Manhattan,1065054,1795,RIVERSIDE DRIVE,140394106,1,A2,N,70,70,No,RESID. BLDG - OLD CODE,RESID. BLDG - OLD CODE,9/22/2015 0:00,8/26/2015,Initial Permit,EW,Issued,Initial Permit,0,0,No,,,Y,67,"INTERIOR RENOVATION OF APT 1J AND 1K TO COMBINE UNITS. MINOR PARTITION CHANGES AND MINOR PLUMBING WORK AS PER PLANS. NO CHANGE IN USE, OCCUPANCY, OR EGRESS."
Manhattan,1065076,585,WEST 214 STREET,123267017,1,A2,N,50,50,No,RESID. BLDG - OLD CODE,RESID. BLDG - OLD CODE,12/18/2017 0:00,12/18/2017,Initial Permit,PL,Issued,Initial Permit,0,0,No,,,Y,2,"FILING HEREWITH APPLICATION TO COMBINE APARTMENT 3A &amp; 3B AS PER TPPN #3/97. WORK TO INCLUDE MINOR DEMOLITION OF NON LOAD BEARING PARTITIONS, NEW FINISHES AND REMOVAL OF ONE KITCHEN. NO CHANGE IN USE, EGRESS OR OCCUPANCY."
Manhattan,1066718,111,THIRD AVENUE,123681453,1,A2,N,149,149,No,RESID. BLDG - OLD CODE,RESID. BLDG - OLD CODE,2/20/2019 0:00,2/15/2019,Initial Permit,EW,Issued,Initial Permit,0,0,No,,,Y,156,"ALTERATIONS TO COMBINED APTS 17CD (17TH FLOOR).  PARTITIONS AND PLUMBING. NO CHANGE TO USE, EGRESS OR OCCUPANCY."
Manhattan,1066718,111,THIRD AVENUE,123869885,1,A2,N,149,149,No,RESID. BLDG - OLD CODE,RESID. BLDG - OLD CODE,4/16/2019 0:00,4/11/2019,Initial Permit,EW,Issued,Initial Permit,0,0,No,,,Y,156,"ALTERATIONS TO COMBINED APTS 4CD (4TH FLOOR).  PARTITIONS AND PLUMBING. NO CHANGE TO USE, EGRESS OR OCCUPANCY."
Manhattan,1067116,421,HUDSON STREET,121595862,1,A2,,185,185,No,RESIDENTIAL APT HOUSE,RESIDENTIAL APT HOUSE,7/11/2014 0:00,1/7/2015,Renewed,EW,Issued,Renewed,0,0,No,,,Y,1,"FILING TO REMODEL AND COMBINE APARTMENTS 423/24/25 ON THE 4TH FLR AS PER TPPN 3/97. GENERAL CONSTRUCTION,FINISH WORK AS WELL AS THE REMOVAL OF TWO KITCHENS FOR THE APARTMENT COMBINATION.NO CHANGE TO USE,EGRESS OR OCCUPANCY ORIGINAL CONDITIONS WERE APPROVED UNDER BSA#606-75-BZ &amp; 607-75-A"
Manhattan,1067116,421,HUDSON STREET,121702416,1,A2,,185,185,No,RESIDENTIAL APT HOUSE,RESIDENTIAL APT HOUSE,7/11/2014 0:00,1/7/2015,Renewed,EW,Issued,Renewed,0,0,No,,,Y,1,"FILING TO REMODEL AND COMBINE APARTMENTS 323/24 ON THE 3RD FLR AS PER TPPN 3/97. GENERAL CONSTRUCTION,FINISH WORK AS WELL AS THE REMOVAL OF TWO KITCHENS FOR THE APARTMENT COMBINATION.NO CHANGE TO USE,EGRESS OR OCCUPANCY ORIGINAL CONDITIONS WERE APPROVED UNDER BSA#606-75-BZ &amp; 607-75-A"
Manhattan,1067116,421,HUDSON STREET,122467302,1,A2,N,183,183,No,RESIDENTIAL APT HOUSE,RESIDENTIAL APT HOUSE,2/25/2016 0:00,8/29/2016,Renewed,EW,Issued,Renewed,0,0,No,,,Y,1,"COMBINE APARTMENT 401, 402 AND 403 PER TPPN 3/97. GENERAL CONSTRUCTION, FINISH WORK AS WELL AS THE REMOVAL OF KITCHENS IN 401 &amp; 403. INCLUDES PLUMBING WORK CONFORMING TO THE 2014 CODE. NO CHANGE IN USE, EGRESS OR OCCUPANCY. ORIGINAL CONDITIONS WERE APPROVED UNDER BSA#606-75-A."
Manhattan,1067116,421,HUDSON STREET,140144804,1,A2,,185,185,No,RESIDENTIAL APT HOUSE,RESIDENTIAL APT HOUSE,2/18/2015 0:00,2/18/2015,Initial Permit,EW,Issued,Initial Permit,0,0,No,,,Y,1,"FILING TO REMODEL AND COMBINE MAISONETTE UNITS M1,M2,M3 &amp; M4,M5 &amp; M6,M7,M8 AS PER TPPN 3/97.GENERAL CONSTRUCTION,FINISH WORK, THE REMOVAL KITCHENS FOR THE UNIT COMBOS. FLOOR AREA REALLOCATION IN CONJUNCTION WITH ALT 1 JOB # 121326145 AS PER 226-10BZ.NO CHANGE TO USE,EGRESS OR OCC. ORIGINAL CONDITIONS WERE APPROVED UNDER BSA#606-75-BZ &amp; 607-75-A."
Manhattan,1067567,2,HORATIO STREET,103544381,1,A2,,,240,No,RESID. BLDG - OLD CODE,,12/11/2015 0:00,12/11/2015,Initial Permit,EW,Issued,Initial Permit,0,0,No,,,Y,243,"COMBINE APARTMENT 8 L,N,P, MINOR INTERIOR PARTITIONS, MINOR PLUMBING WORK, REMOVE 2 KITCHENS AND CAP LINES. NO CHANGE IN USE EGRESS OR OCCUPANCY."
Manhattan,1067567,2,HORATIO STREET,121724170,1,A2,,212,212,No,RESIDENTIAL APT HOUSE,RESIDENTIAL APT HOUSE,10/21/2014 0:00,1/12/2015,Renewed,EW,Issued,Renewed,0,0,No,,,Y,243,"HEREWITH FILE PLANS TO COMBINE APT. 3L WITH 3M. WORK TO INCLUDE REMOVAL OF NON-LOAD BEARING PARTITION WALL, NEW PARTITIONS AND FINISHES AND PLUMBING.  NO CHANGE TO USE, EGRESS OR OCCUPANCY."
Manhattan,1067567,2,HORATIO STREET,122343712,1,A2,N,241,241,No,RESID. BLDG - OLD CODE,RESID. BLDG - OLD CODE,3/25/2015 0:00,3/24/2015,Initial Permit,EW,Issued,Initial Permit,0,0,No,,,Y,243,"COMBINE APT. 12G WITH APT.14G TO CREATE A DUPLEX APARTMENT (IN COMPLIANCE WITH TTPN 3/97, COMBINING APTS. WITHOUT  OBTAINING C. OF O.) REMOVE ONE KITCHEN, PERFORM PARTITION WORK, INSTALL NEW STAIR TO CONNECT THE APTS. PERFORM PLUMBING AND ELECTRICAL WORK IN CONJUNCTION WITH RENOVATION. NO CHANGE TO USE, OCCUPANCY, EGRESS OR FIRE PROTECTION."
Manhattan,1067567,2,HORATIO STREET,122445274,1,A2,N,241,241,No,RESID. BLDG - OLD CODE,RESID. BLDG - OLD CODE,10/21/2015 0:00,10/6/2015,Initial Permit,EW,Issued,Initial Permit,0,0,No,,,Y,243,"COMBINE AND RENOVATE APARTMENTS 5R AND 5P, MINOR PARTITION AND PLUMBING FIXTRURE REVISIONS, THE PROPERTY IS NOT IN A SPECIAL FLOOD HAZARD AREA PER EFFECTIVE 2007 FIRM OR PRELIMINARY FLOOD MAPS RELEASED IN 2013, NO CHANGE TO USE, EXITS OR OCCUPANCY"
Manhattan,1067567,2,HORATIO STREET,122922221,1,A2,N,242,242,No,RESID. BLDG - OLD CODE,RESID. BLDG - OLD CODE,11/16/2016 0:00,11/14/2016,Initial Permit,EW,Issued,Initial Permit,0,0,No,,,Y,243,"COMBINE APARTMENTS 12AB AND 12C, INSTALL THROUGH THE WALL HVAC SLEEVES, APARTMENT RENOVATION, MINOR PLUMBING FIXTURE AND PARTITION REVISIONS, THE PROPERTY IS N OT IN A FLOOD HAZARD AREA PER 2007 FIRM OR PRELIMINARY FLOOD MAPS RELEASE IN 2013, NO CHANGE TO USE, EXITS OR OCCUPANCY"
Manhattan,1067716,302,WEST 12TH STREET,123049717,1,A2,N,128,128,No,RESID. BLDG - OLD CODE,RESID. BLDG - OLD CODE,7/11/2017 0:00,6/21/2017,Initial Permit,EW,Issued,Initial Permit,0,0,No,,,Y,1,"FILED TO COMBINE APARTMENT 16D &amp; 16E AS PER TPPN #3/1997 FOR PARTIAL 16TH FLOOR. INTERIOR RENOVATION TO INCLUDE NON-BEARING PARTITIONS, FINISHES, REMOVAL, REPLACEMENT OF FIXTURES, AND PLUMBING AS PER PLANS. NO CHANGE OF USE, EGRESS, OR OCCUPANCY."
Manhattan,1068149,200,W 20 ST,123722828,1,A2,N,198,198,No,RESID. BLDG - OLD CODE,RESID. BLDG - OLD CODE,11/22/2019 0:00,10/18/2019,Initial Permit,EW,Issued,Initial Permit,0,0,No,,,Y,199,"APPLICATION FILED FOR INTERIOR RENOVATION TO COMBINE APT 201 &amp; 202(2ND FLOOR). REMOVE NON-LOAD BEARING PARTITION WALLS, RELOCATE AND REPLACE PLUMBING FIXTURES AS PER PLAN. THIS APPLICATION WILL NOT AFFECT ANY USE, EGRESS OR OCCUPANCY."
Manhattan,1070689,160,WEST END AVENUE,122284429,1,A2,N,507,507,No,RESID. BLDG - OLD CODE,RESID. BLDG - OLD CODE,3/9/2015 0:00,3/9/2015,Initial Permit,EW,Issued,Initial Permit,0,0,No,,,Y,508,"REMOVE &amp; REINSTALL NON LOAD BEARING PARTITIONS &amp; INSTALL NEW FINISHES TO COMBINE APT. UNITS 29J &amp; K. REMOVE KITCHEN IN FORMER APT. 29K &amp; CAP LINES AS REQUIRED. REMODEL KITCHEN IN FORMER APT.29J REUSING OR REPLACING FIXTURES AS PER SCH.B &amp; PLANS   FILED.NO CHANGE TO EXISTING USE,OCCUPANCY OR EGRESS."
Manhattan,1070689,160,WEST END AVE.,122636987,1,A2,N,507,507,No,RESIDENTIAL APT HOUSE,RESIDENTIAL APT HOUSE,3/14/2016 0:00,2/29/2016,Initial Permit,EW,Issued,Initial Permit,0,0,No,,,Y,508,"APPLICATION FILED TO COMBINE APTS P &amp; R UNDER TPPN 3/97 WITH INTERIOR RENOVATION THAT INCLUDES REMOVAL OF NON BEARING PARTITIONS, RE CONFIGURING EXISTING NON BEARING PARTITIONS, REMOVE 1 KITCHEN AND UPGRADING THE FIXTURES IN THE EXISTING KITCHEN &amp; BATHS. ADD WASHER &amp; ELECTRIC DRYER  INSTALL ONE WALL MOUNTED FAN COIL UNIT."
